{
  "name": "all-flags-rung-15",
  "description": "Every flag set and rung 15 (the header allows rungs the ladder does not use).",
  "hex": "0ef001000100000000000001674b7be9b339732d84132e0513a10977893fc7a6885b61a8d40000000168121d66b9db4f62620d4bdd460107f9fed10d6b69a2d39f6cb4d9a86a2a85ee820000000165d8c0e4c07c2b97400767b57961067c726254304ae8469504ba232b1620f027b03e9c36cd35f0f1fa",
  "expect": {
    "header": {
      "ver": 0,
      "type": 0,
      "keyframe": true,
      "param_sets": true,
      "rung_changed": true,
      "rung": 15,
      "seq": 1,
      "pts_ms": 1
    },
    "payload_hex": "00000001674b7be9b339732d84132e0513a10977893fc7a6885b61a8d40000000168121d66b9db4f62620d4bdd460107f9fed10d6b69a2d39f6cb4d9a86a2a85ee820000000165d8c0e4c07c2b97400767b57961067c726254304ae8469504ba232b1620f027b03e9c36cd35f0f1fa"
  }
}
