{
  "name": "video-p-frame",
  "description": "Video non-IDR slice, no parameter sets.",
  "hex": "002013042721000000000001618c21ff72edd718d94e139513dc1b63fc9306f6bf9ce506e0",
  "expect": {
    "header": {
      "ver": 0,
      "type": 0,
      "keyframe": false,
      "param_sets": false,
      "rung_changed": false,
      "rung": 2,
      "seq": 1043,
      "pts_ms": 8487
    },
    "payload_hex": "00000001618c21ff72edd718d94e139513dc1b63fc9306f6bf9ce506e0"
  }
}
