{
  "name": "audio-opus-packet",
  "description": "One 20 ms Opus packet at rung 2.",
  "hex": "1020ff01e42000001966fb7f2f908295424b45799d1767e5b593808129caf3107a430f5d8ac7e8e3d6f0f33f73766456ca394846130e610e924ac5fc940f35da28593ed79e",
  "expect": {
    "header": {
      "ver": 0,
      "type": 1,
      "keyframe": false,
      "param_sets": false,
      "rung_changed": false,
      "rung": 2,
      "seq": 511,
      "pts_ms": 8420
    },
    "payload_hex": "1966fb7f2f908295424b45799d1767e5b593808129caf3107a430f5d8ac7e8e3d6f0f33f73766456ca394846130e610e924ac5fc940f35da28593ed79e"
  }
}
